{
  "intervals": {
    "block_days": 14,
    "level": 0.95,
    "method": "date-block bootstrap",
    "min_sample_blocks": 21,
    "n_boot": 2000,
    "note": "The 30-day window spans only a few 14-day blocks, fewer than min_sample_blocks (21), so every interval is approximate and the window is too short for a significance call."
  },
  "log": {
    "first_run_date": "2023-07-14",
    "head_chain_sha256": "98f55af5bd6dc9b329f960019eee1b6d3ef0a71fe3e2b3606751b0116e78d360",
    "last_run_date": "2026-05-06",
    "late_rejected_total": 0,
    "partitions": 3,
    "rows": 30,
    "verified": true
  },
  "national": [
    {
      "bias_f": -0.04,
      "bias_hi_f": null,
      "bias_lo_f": null,
      "lead_day": 1,
      "mae_f": 0.04,
      "mae_hi_f": null,
      "mae_lo_f": null,
      "min_sample_flag": true,
      "n": 1,
      "n_blocks": 1,
      "n_dates": 1,
      "no_detectable_bias": true,
      "skill": 0.0,
      "skill_hi": 0.0,
      "skill_lo": 0.0,
      "source": "raw_nbm",
      "variable": "max"
    },
    {
      "bias_f": -1.04,
      "bias_hi_f": null,
      "bias_lo_f": null,
      "lead_day": 1,
      "mae_f": 1.04,
      "mae_hi_f": null,
      "mae_lo_f": null,
      "min_sample_flag": true,
      "n": 1,
      "n_blocks": 1,
      "n_dates": 1,
      "no_detectable_bias": true,
      "skill": -25.0,
      "skill_hi": null,
      "skill_lo": null,
      "source": "baseline",
      "variable": "max"
    },
    {
      "bias_f": 0.46,
      "bias_hi_f": null,
      "bias_lo_f": null,
      "lead_day": 1,
      "mae_f": 0.46,
      "mae_hi_f": null,
      "mae_lo_f": null,
      "min_sample_flag": true,
      "n": 1,
      "n_blocks": 1,
      "n_dates": 1,
      "no_detectable_bias": true,
      "skill": -10.5,
      "skill_hi": null,
      "skill_lo": null,
      "source": "challenger",
      "variable": "max"
    },
    {
      "bias_f": 3.92,
      "bias_hi_f": null,
      "bias_lo_f": null,
      "lead_day": 2,
      "mae_f": 3.92,
      "mae_hi_f": null,
      "mae_lo_f": null,
      "min_sample_flag": true,
      "n": 1,
      "n_blocks": 1,
      "n_dates": 1,
      "no_detectable_bias": true,
      "skill": 0.0,
      "skill_hi": 0.0,
      "skill_lo": 0.0,
      "source": "raw_nbm",
      "variable": "max"
    },
    {
      "bias_f": 2.92,
      "bias_hi_f": null,
      "bias_lo_f": null,
      "lead_day": 2,
      "mae_f": 2.92,
      "mae_hi_f": null,
      "mae_lo_f": null,
      "min_sample_flag": true,
      "n": 1,
      "n_blocks": 1,
      "n_dates": 1,
      "no_detectable_bias": true,
      "skill": 0.255,
      "skill_hi": null,
      "skill_lo": null,
      "source": "baseline",
      "variable": "max"
    },
    {
      "bias_f": 4.42,
      "bias_hi_f": null,
      "bias_lo_f": null,
      "lead_day": 2,
      "mae_f": 4.42,
      "mae_hi_f": null,
      "mae_lo_f": null,
      "min_sample_flag": true,
      "n": 1,
      "n_blocks": 1,
      "n_dates": 1,
      "no_detectable_bias": true,
      "skill": -0.128,
      "skill_hi": null,
      "skill_lo": null,
      "source": "challenger",
      "variable": "max"
    },
    {
      "bias_f": 1.06,
      "bias_hi_f": null,
      "bias_lo_f": null,
      "lead_day": 1,
      "mae_f": 1.06,
      "mae_hi_f": null,
      "mae_lo_f": null,
      "min_sample_flag": true,
      "n": 1,
      "n_blocks": 1,
      "n_dates": 1,
      "no_detectable_bias": true,
      "skill": 0.0,
      "skill_hi": 0.0,
      "skill_lo": 0.0,
      "source": "raw_nbm",
      "variable": "min"
    },
    {
      "bias_f": 0.06,
      "bias_hi_f": null,
      "bias_lo_f": null,
      "lead_day": 1,
      "mae_f": 0.06,
      "mae_hi_f": null,
      "mae_lo_f": null,
      "min_sample_flag": true,
      "n": 1,
      "n_blocks": 1,
      "n_dates": 1,
      "no_detectable_bias": true,
      "skill": 0.943,
      "skill_hi": null,
      "skill_lo": null,
      "source": "baseline",
      "variable": "min"
    },
    {
      "bias_f": 1.56,
      "bias_hi_f": null,
      "bias_lo_f": null,
      "lead_day": 1,
      "mae_f": 1.56,
      "mae_hi_f": null,
      "mae_lo_f": null,
      "min_sample_flag": true,
      "n": 1,
      "n_blocks": 1,
      "n_dates": 1,
      "no_detectable_bias": true,
      "skill": -0.472,
      "skill_hi": null,
      "skill_lo": null,
      "source": "challenger",
      "variable": "min"
    },
    {
      "bias_f": -0.92,
      "bias_hi_f": null,
      "bias_lo_f": null,
      "lead_day": 2,
      "mae_f": 0.92,
      "mae_hi_f": null,
      "mae_lo_f": null,
      "min_sample_flag": true,
      "n": 1,
      "n_blocks": 1,
      "n_dates": 1,
      "no_detectable_bias": true,
      "skill": 0.0,
      "skill_hi": 0.0,
      "skill_lo": 0.0,
      "source": "raw_nbm",
      "variable": "min"
    },
    {
      "bias_f": -1.92,
      "bias_hi_f": null,
      "bias_lo_f": null,
      "lead_day": 2,
      "mae_f": 1.92,
      "mae_hi_f": null,
      "mae_lo_f": null,
      "min_sample_flag": true,
      "n": 1,
      "n_blocks": 1,
      "n_dates": 1,
      "no_detectable_bias": true,
      "skill": -1.087,
      "skill_hi": null,
      "skill_lo": null,
      "source": "baseline",
      "variable": "min"
    },
    {
      "bias_f": -0.42,
      "bias_hi_f": null,
      "bias_lo_f": null,
      "lead_day": 2,
      "mae_f": 0.42,
      "mae_hi_f": null,
      "mae_lo_f": null,
      "min_sample_flag": true,
      "n": 1,
      "n_blocks": 1,
      "n_dates": 1,
      "no_detectable_bias": true,
      "skill": 0.543,
      "skill_hi": null,
      "skill_lo": null,
      "source": "challenger",
      "variable": "min"
    }
  ],
  "schema_version": "1.1.0",
  "window": {
    "basis": "target_date",
    "days": 30,
    "end": "2023-07-16",
    "start": "2023-06-17"
  }
}
